date,explanation,media_type,title,url,copyright
1996-09-27,"Today is Shannon Lucid's first day on Planet Earth in six months. Her stay aboard Russia's Mir Space Station was of record length - the longest stay of any American in space ever. During her time in orbit around the Earth, Lucid, a biochemist, did many things including experiments on the effect of weightlessness on the human body. Pictured above, Lucid greets the astronaut that will replace her on Mir, John Blaha.",image,"Welcome Home Shannon Lucid Credit:",https://apod.nasa.gov/apod/image/slucid_sts79.gif,nan
1996-09-28,"Pictured above is a three person Russian Soyuz capsule with wing-like solar panels extended, joined to the Mir space station. In Russian soyuz means union and indeed one of the milestones achieved by a Soyuz spacecraft was an orbital union with a US Apollo command module during the first international space mission (Apollo-Soyuz) in 1975. The Soyuz TM spacecraft are specially modified for use with the Mir as ferries for cosmonauts and astronauts and also as lifeboats, should the need arise. This image is from an electronic still camera used by the crew of the Space Shuttle Atlantis during their latest Mir visit to pick up astronaut Shannon Lucid and drop off John Blaha.",image,A Soyuz at Mir Credit:,https://apod.nasa.gov/apod/image/soyuz_sts79.gif,nan
1996-09-29,"This X-Ray image of the Moon was made by the orbiting Roentgen Observatory Satellite (ROSAT) in 1990. It shows three distinct regions: a bright X-ray sky, a bright part of the Moon, and a relatively dark part of the Moon. The bright X-ray sky is due to the diffuse cosmic X-ray background. The bright lunar crescent shines because it reflects X-rays emitted by the Sun. The dark lunar face is in shadow and so stands stands out from the relatively bright background - but, surprisingly it is not completely dark! Where do those X-rays from? They are currently thought to result from energetic particles from the solar wind bombarding the lunar surface.",image,The X-Ray Moon Credit:,https://apod.nasa.gov/apod/image/moon_rosat.gif,nan
1996-09-30,"How do planets, stars, and galaxies form? How do they evolve? The International Ultraviolet Explorer (IUE) satellite was launched in 1978 and operated by NASA/ ESA/ PPARC to help provide answers to some of the most fundamental questions about the contents of our universe. IUE served as a geostationary orbiting observatory for the next 18 years acquiring over 100,000 observations with its onboard ultraviolet spectrographs. Its prodigious scientific output is only hinted at by the all-sky plot above which shows the locations of IUE's many pointed observations over its long operational history. The brightness of a point on the sky represents the the number of IUE observations. The plot is in galactic coordinates (the plane of our Galaxy runs horizontally through the middle) and reveals the positions of distant quasars, galaxies, stars, star clusters, nebulae, novae, and supernovae - testifying to IUE's broad range of capabilities. The ecliptic plane is also visible running diagonally through the center, traced out by many observations of solar system objects. After over 18 years, IUE's science operations officially end today as the final commands are transmitted to the aging satellite by controllers at NASA's Goddard Space Flight Center. Astronomers from around the world whose careers have been touched by IUE have expressed their fond farewells to this most productive and longest lived astronomical satellite and their thanks to all who have made IUE's remarkable voyage of exploration possible.   News Flash:  BATSE Detects Huge Gamma Ray Burst",image,Exploring The Universe With IUE 1978-1996 Credit:,https://apod.nasa.gov/apod/image/iue_allsky.gif,nan
1996-10-01,"Something big exploded but astronomers have no idea what. On September 24th, the Burst and Transient Source Experiment (BATSE) onboard the orbiting Compton Gamma Ray Observatory recorded the most intense gamma ray burst in its five year history. During its mission, BATSE has recorded many gamma ray bursts - about one per day, but none were this powerful. Since their discovery over 25 years ago, the origin and even distance to gamma ray bursts remains hotly debated. Bursts are surely mysterious phenomena: they flash into existence suddenly dominating the entire gamma-ray sky, then typically fade in a few seconds never to be seen again. It is possible that this intense wave of gamma radiation caused other satellites to glitch and may even have been the cause of unusual noise in the Earth's atmosphere. If you know of such an anomaly, please report it.",image,"BATSE's Biggest Gamma Ray Burst (Yet) Credit:",https://apod.nasa.gov/apod/image/bigburst_batse_big.gif,nan
1996-10-02,"The Horsehead Nebula is arguably the most famous nebula on the sky.  It is visible as the black indentation to the red emission nebula seen just to the right of center of the above photograph. The bright star near the center is located in the belt of the familiar constellation of Orion. The horse-head feature is dark because it is really an opaque dust cloud which lies in front of the bright red emission nebula. Like clouds in Earth's atmosphere, this cosmic cloud has assumed a recognizable shape by chance. After many thousands of years, the internal motions of the cloud will alter its appearance. The emission nebula's red color is caused by electrons recombining with protons to form hydrogen atoms. Also visible in the picture are blue reflection nebulae, which preferentially reflect the blue light from nearby stars.",image,Orion's Horsehead Nebula  Credit:,https://apod.nasa.gov/apod/image/horsehead2_dm.gif,Anglo-Australian Telescope Board  
1996-10-03,"The Galileo spacecraft orbiting Jupiter continues to return impressive results. The Galileo team has just released three more photographs of Jupiter's volcanic moon Io taken in June.  These three photos are reflected at the bottom of the above picture, digitally enhanced to better show important features. Some areas of Io, it now appears, are truly red, not the usual green and yellow hues recorded previously. In fact, the last major mission - Voyager - did not have cameras sensitive to red light. This red material appears to be associated with recent volcanic eruptions, and the red color appears to fade with time. Comparisons of these photos with 17-year old Voyager photos show that about a dozen surface regions -- each the size of Connecticut-- have been affected by Io's active volcanoes.",image,"Three Views of Jupiter's Io Credit:",https://apod.nasa.gov/apod/image/io3_gal.gif,nan
1996-10-04,"Does an old, red globular cluster have any hot, blue stars? The rightmost picture, taken by the Ultraviolet Imaging Telescope in ultraviolet light, shows that indeed it does. Pictured, Omega Centauri is the largest known globular cluster in our Galaxy, containing well over a million stars. Many of these stars are evident in the visible light photograph on the left. When photographed in ultraviolet light, however, different and less numerous stars emerge, as evident on the photograph on the right. Most of these stars are thought to have evolved past the current stage of our Sun. These stars no longer fuse hydrogen to helium in their core but rather fuse helium into carbon. These stars will soon shed their outer envelopes and end up as smoldering carbon embers known as white dwarf stars.",image,"Globular Cluster Omega Centauri Credit:",https://apod.nasa.gov/apod/image/omgcen_uit.gif,nan
1996-10-05,"1500 light years away lies a nebula of quite peculiar shape. How did the dark dust cloud shown above come to be shaped like a horse's head? Nobody knows! Barnard 33, as this region is known to some, is surely a dark dust cloud absorbing the light from the bright red emission nebula behind it. The Horsehead Nebula is also thought to be a region where low-mass stars form. But the reason for gross shapes in the universe is frequently poorly understood. Perhaps there is no simple explanation in this case. Some stars are thought to be efficient creators of dust, while others are much better at destroying it. The Horsehead Nebula's dust distribution might just be the result of a specific irregular distribution of stars and gas in its vicinity.",image,"A Close-Up of the Horsehead Nebula  Credit and Copyright:",https://apod.nasa.gov/apod/image/hhead_vw.gif,nan
1996-10-06,"The Earth's northern hemisphere appears outlined as a sunlit crescent in this dramatic view from the GOES 8 satellite. The image was made near midnight for the Geostationary Operational Environmental Satellite on June 22 this year, two days after the Summer Solstice. The Summer Solstice is the time of year when the sun reaches its greatest northern declination and the arctic regions near the top of the picture experience 24 hours of daylight. Looking south along the Earth's limb, atmospheric scattering of sunlight causes the bright crescent to be visible beyond areas directly illuminated by the sun.",image,"A Crescent Earth At Midnight Credit:",https://apod.nasa.gov/apod/image/cresearth_goes8.gif,nan
1996-10-07,"Caught in the act earlier this summer by the Hubble Space Telescope, the volcanic moon Io (above and right of center) and its shadow (black dot) are seen here against Jupiter's clouds. Io's shadow is 2,262 miles in diameter (about the size of Io) as it races across the swirling cloud tops at about 38,000 miles per hour. From our perspective in the inner Solar System, dramatic scenes like this one are possible when Jupiter, Io, and the Sun line up. What would this scene look like when viewed from Jupiter's cloud tops? As the shadow passed over Jupiter, for observers along the shadow's track, Io's disk would appear to eclipse the sun. The situation is familiar to those Earth Dwellers who have seen a Solar Eclipse - visible from along the track of the Moon's shadow passing across the surface of the Earth.",image,"Io's Shadow Credit:",https://apod.nasa.gov/apod/image/ioshadow_hst.gif,nan
1996-10-08,"Launched in 1990, the orbiting ROSAT observatory explored the Universe by viewing the entire sky in x-rays - photons with about 1,000 times more energy than visible light. This ROSAT survey produced the sharpest, most sensitive image of the x-ray sky to date. The all-sky image is shown with the plane of our Milky Way Galaxy running horizontally through the center. Both x-ray brightness and relative energy are represented with red, green, and blue colors indicating three x-ray energy ranges (from lowest to highest). Bright x-ray spots near the galactic plane are within our own Milky Way. The brightest region (right of center) is toward the Vela Pulsar and the Puppis supernova remnant. Bright sources beyond our Galaxy are also apparent, notably the Virgo cluster of galaxies (near top right) and the Large Magellanic Cloud (LMC). The LMC is easy to find here as several of the black stripes (blank areas caused by missing data) seem to converge on its position (lower right). Over large areas of the sky a general diffuse background of x-rays dominates. Hot gas in our own Galaxy provides much of this background and gives rise to the grand looping structures visible in the direction of the galactic center (image center). Unresolved extragalactic sources also add to this background, particularly above and below the plane. Despite the x-ray sky's exotic appearance, a very familiar feature is visible - the gas and dust clouds which line the plane of our galaxy absorb x-rays as well as optical light and produce the dark bands running through the galactic center.",image,ROSAT Explores the X-Ray Sky,https://apod.nasa.gov/apod/image/xallsky_rosat.gif,nan
1996-10-09,"Andromeda is the nearest major galaxy to our own Milky Way Galaxy. Our Galaxy is thought to look much like Andromeda. Together these two galaxies dominate the Local Group of galaxies. The diffuse light from Andromeda is caused by the hundreds of billions of stars that compose it. The several distinct stars that surround Andromeda's image are actually stars in our Galaxy that are well in front of the background object. Andromeda is frequently referred to as M31 since it is the 31st object on Messier's list of diffuse sky objects. M31 is so distant it takes about 2 million years for light to reach us from there. Much about M31 remains unknown, including why the center contains two nuclei.",image,M31: The Andromeda Galaxy,https://apod.nasa.gov/apod/image/m31_oregon.gif, Jason Ware 
1996-10-10,"Today marks the 150th anniversary of the discovery of Triton. On October 10 1846, William Lassell was observing the newly discovered planet Neptune. He was attempting to confirm his observation, made just the previous week, that Neptune had a ring. But this time he discovered that Neptune had a satellite as well. Lassell soon proved the ring was product of his new telescope's distortion, but the satellite Triton remained. The above picture of Triton was taken in 1989 by the only spacecraft ever to pass Triton: Voyager 2. Voyager 2 found fascinating terrain, a thin atmosphere, and even evidence for ice volcanoes on this world of peculiar orbit and spin. Ironically, Voyager 2 also confirmed the existence of complete thin rings around Neptune - but these would have been quite invisible to Lassell!",image,Triton: Neptune's Largest Moon,https://apod.nasa.gov/apod/image/triton1_vg2.gif,nan
1996-10-11,"The center of M31 is twice as unusual as previously thought. In 1991 the Planetary Camera then onboard the Hubble Space Telescope pointed toward the center of our Milky Way's closest major galactic neighbor: Andromeda (M31). To everyone's surprise, M31's nucleus showed a double structure. The nuclear hot-spots are quite close together when considering Galactic distances: M31 is about 150,000 light years across while the above shows only the central 30 light-years. Subsequent ground-based observations have led to speculation that indeed two nuclei exist, are moving with respect to each other, that one nucleus is slowly tidally disrupting the other, and that one nucleus may be the remains of smaller galaxy eaten by M31. The nuclei of many galaxies, including M31, are known to be quite violent places, and the existence of massive black holes are frequently postulated to explain them.",image,The Double Nucleus of M31,https://apod.nasa.gov/apod/image/m31nuc2_hst.gif,nan
1996-10-12,"What alien planet's bizarre landscape lurks below these fiery-looking clouds? It's only Planet Earth, of course -- as seen on the Water Vapor Channel. Hourly, images like this one (shown in false color) are brought to you by the orbiting GOES 8 satellite's multi-channel imager. This instrument can produce images at the infrared wavelength of 6.7 microns or about 10 times the wavelength of visible light, recording radiation emitted by water vapor in the upper troposphere. Bright regions correspond to high concentrations of water vapor while dark spots are relatively dry areas. Atmospheric water vapor is invisible to the eye and produced by evaporation from the oceans. Convected upward in the tropical zones it affects the climate by contributing substantially to the greenhouse effect.",image,The Water Vapor Channel,https://apod.nasa.gov/apod/image/watervapor_goes8.gif,nan
1996-10-13,The Lunar Orbiter 1 spacecraft was launched in 1966 to map the lunar surface in preparation for the Apollo moon landings. NASA's plucky robotic explorer performed its job well and pioneered this classic view of the Earth poised above the lunar horizon. The first humans to directly witness a similar scene were the Apollo 8 astronauts. As they orbited the Moon in December of 1968 they also recorded Earth rise in a photograph that was to become one of the most famous images in history - a moving portrait of our world from deep space.,image,The Earth Also Rises,https://apod.nasa.gov/apod/image/earthrise_lo1.gif,nan
1996-10-14,"These two clusters of bright, newly formed stars surrounded by a glowing nebula lie 10 million light years away in the dim, irregular galaxy cataloged as NGC 2366. The Hubble Space Telescope image shows that the youngest cluster, the bottom one at about 2 million years old, is still surrounded by the gas and dust cloud it condensed from, while powerful stellar winds from the stars in the older cluster at the top (4-5 million years old), have begun to clear away its central areas giving the entire nebula an apparent hook shape. Compared to the sun, the stars in these clusters are massive and short lived. The brightest one, near the tip of the hook, is a rare Luminous Blue Variable with 30 to 60 times the mass of the sun - similar to the erruptive Eta Carina variable in our own Milky Way. Stars this massive are extremely variable. A comparison with ground based images indicates that in three years this star's brightness increased by about 40 times making it currently the brightest star in this dim galaxy. Studies of such distant and diverse galaxies yield clues to the relationships of star formation and galactic evolution.",image,"Bright Stars, Dim Galaxy",https://apod.nasa.gov/apod/image/ngc2366_hst.gif,nan
1996-10-15,"Hurtling through space a mere 3,000 miles above the Martian surface, the diminutive moon Phobos (below and left of center) was imaged against the backdrop of a large shield volcano by the Viking 2 Orbiter in 1977. This dramatic picture looks down from the Orbiter's viewpoint about 8,000 miles above the volcano, Ascraeus Mons. Phobos itself is 5,000 miles below the Orbiter. North is toward the top with the Sun illuminating the scene from the South (black dots are reference marks). For scale, Ascraeus Mons is about 200 miles across at its base while asteroid sized Phobos is about 15 miles in diameter. In this spectacular moon-planet image, volcanic calderas (craters) are visible at the summit of Ascraeus Mons -- while impact craters on the sunlit side of Phobos' surface can also be seen!",image,Phobos Over Mars,https://apod.nasa.gov/apod/image/phobosmars_viking2.gif,nan
1996-10-16,"Research balloon flights conducted in 1912 by Austrian physicist Victor Hess revealed that the Earth was constantly bombarded by high energy radiation from space - which came to be called Cosmic Rays. What are Cosmic Rays and where do they come from? They are now known to be mostly subatomic particles - predominantly protons and electrons - but their origin is a long standing mystery. After almost a century of study, this cosmic puzzle may have been at least partially solved by new X-ray images and spectra from the ASCA satellite observatory. Pieced together to show the region around a star observed to go supernova in 1006 AD, the overlapping X-ray snapshots above (seen in false color) reveal the bright rims of the exploded star's still expanding blast wave. These ASCA observations show for the first time that the energy spectrum of the bright regions is like that produced by extremely high energy electrons streaming through a magnetic field at nearly the speed of light. If (as expected) high energy protons are associated with these energetic electrons then supernova remnants like SN 1006 are sources of Hess' puzzling Cosmic Rays.",image,SN 1006: Pieces of the Cosmic Ray Puzzle,https://apod.nasa.gov/apod/image/sn1006_asca1.gif,nan
1996-10-17,"Are planets common in our galaxy? Strong evidence that the answer is yes was provided in this 1994 image made by the Hubble Space Telescope .  A close-up of the Orion Nebulae, it reveals what seem to be disks of dust and gas surrounding newly formed stars. These fuzzy blobs, called proplyds, appear to be infant solar systems in the process of formation. Of the five stars in this field which spans about 0.14 light years, four appear to have associated proplyds - three bright ones and one dark one seen in silhouette against the bright nebula. A more complete survey of 110 stars in the region found 56 with proplyds. If extra-solar planetary systems are common place, are there extra-terrestrial civilizations out there as well?",image,Proplyds: Infant Solar Systems?,https://apod.nasa.gov/apod/image/proplyds_hst.gif,nan
1996-10-18,"Auroras are especially large on Jupiter.  In pictures released yesterday, the Hubble Space Telescope imaged these unusual light displays in more detail than ever before. Jupiter's auroras are linked to its volcanic moon Io. Io's volcanoes release particles, some of which become ionized, trapped by Jupiter's magnetic field, and rain down on the gas giant. The resulting auroral displays may be thousands of times brighter than any auroral display on Earth, and involve unusual spots. The above pictures show how the extended auroral emissions rotate with Jupiter, while the auroral spots stay synchronized to Io as it circles Jupiter.",image,Jupiter's Auroras  Credit:,https://apod.nasa.gov/apod/image/jupaurora_hst.gif,nan
1996-10-19,"What's the closest extrasolar planetary system? It may well be planets of the dim red dwarf star cataloged as Lalande 21185 -- a mere 8 light years distant. This star is too faint to be seen by the naked eye and its planets have not been imaged directly. Instead, their presence is inferred by a long series of telescopic observations, tracking the star as it wiggles and wobbles in mutual gravitational response to the masses of its orbiting planets. Our own planetary system would be detectable by such a technique ... Using data obtained from frequent observations of this star over the last 50 years, University of Pitsburgh astronomer George Gatewood recently announced that much of Lalande 21185's wobble is most likely due to an unseen planet with approximately 90% of the mass of Jupiter and an orbital period of 5.8 years. His work also indicates that a second and possibly third planet of similar mass could well be present in the system. Massive planets orbiting a red dwarf star would be very different from the Earth -- as illustrated in this artist's vision of a Jupiter-sized planet with rings and moons lit by a cool, dim sun. Nevertheless, the existence of a planetary system so near our own suggests the intriguing possibility that planets are common in our galaxy.",image,Lalande 21185: The Nearest Planetary System?,https://apod.nasa.gov/apod/image/lalandeb_whatm.gif," John Whatmough, Extrasolar Visions "
1996-10-20,"Safe! -- In September 1967 (during regular season play), while making a successful soft landing on the Moon's Mare Tranquillitatis, the Surveyor 5 lander actually slid several feet. Equipped with television cameras and some soil sampling experiments, the US Surveyor spacecraft were intended to determined if the lunar surface at chosen locations was suitable for manned landings. Surveyor 5 touched down on the inside edge of a small crater inclined at about 20 degrees. Its footpad slipped and dug the trench visible in the picture. Covered with lunar soil, the footpad is about 20 inches in diameter.",image,Surveyor Slides,https://apod.nasa.gov/apod/image/moonslide_surveyor5.gif,nan
1996-10-21,"Tonight you might be able to see Halley's Comet again - or at least some pieces of it. It is widely thought that that the meteors from the Orionids meteor shower, which peaks tonight, are just small pieces of Halley's Comet falling to Earth. During each pass near the Sun, a comet will heat up and shed pieces of ice and rock from its nucleus. This debris continues to orbit the Sun until either evaporating or being swept up by some large solar-system body. A piece of comet debris striking the Moon creates a small crater, but a piece striking the Earth usually burns up in the atmosphere causing a brief, bright streak. Every year at this time the Earth crosses an old stream of bits from Halley's Comet causing the Orionids display, named from the constellation (Orion) from which the meteors appear to originate. The streak below center in the above picture of the northern sky actually depicts a meteor from the Perseid meteor shower, a usually even more impressive display that peaks every year in mid-August.",image,"Orionids Meteor Shower to Peak Tonight  Credit:",https://apod.nasa.gov/apod/image/perseid_vw.gif,nan
1996-10-22,"What caused the cracks in this giant ice-ball? Jupiter's moon Europa has smoothest surface in the solar system and is composed mostly of cracked water-ice. In the above false-colored picture released last week by the NASA team in charge of the Galileo mission, blue hues represent ice plains divided by dirty red and brown bands of mottled terrain. As the robot Galileo spacecraft orbits Jupiter, it sends back revealing pictures of Jupiter and its large moons including Europa, Io, Ganymede, and Callisto. The region of Europa highlighted above is known as Minos Linea. The cause for many of the cracks remains unknown but may involve shifting stresses from gravity and temperature variations. The new Galileo pictures have increased evidence that liquid oceans may indeed exist under these giant ice-sheets, a place possibly ripe for the development of life.",image,The Cracked Ice Plains of Europa,https://apod.nasa.gov/apod/image/europacracks_gal.gif,nan
