date,explanation,media_type,title,url,copyright
1996-02-28,"Tremendous explosions near the center of our Galaxy were discovered just this past December and are being announced today by a paper in Nature and a press conference at NASA. Bursts like these have never been seen before, and so the exact cause is unknown and will likely be the source of  astronomical speculations and observations for years to come. Much more powerful than any explosions we humans can create, these eruptions likely involve the extreme conditions found only on the surface of a neutron star in a binary system, possibly similar to the X-ray binary system depicted in the above drawing. The new source, dubbed GRO J1744-28 for its discovery spacecraft and position, currently produces multiple pulsed bursts of energy per day, each of which last several seconds. The bursts are quite prominent in X-ray light. Discovery team leaders include Chryssa Kouveliotou (USRA) and Gerald Fishman (NASA /MSFC).",image,Explosions Discovered Near Galactic Center,https://apod.nasa.gov/apod/image/bh_nasm.gif,nan
1996-02-29,"Today, February 29th, is a leap day - a relatively rare occurrence. Advised by Alexandrian astronomer Sosigenes, Roman dictator  Julius Caesar, pictured above in a self-decreed minted coin, created a calender system in 46 BC that contained one leap day every four years. The reason for adding leap days was that a year - defined by the time it takes the Earth to circle the Sun - does not actually take an exact integer number of days - defined by the time it takes for the Earth to rotate once. In fact, one year by these astronomical definitions is about 365.24219 days. If all calendar years contained 365 days, they would drift from the actual year by about 1 day every 4 years. Eventually July (named posthumously for Julius Caesar himself) would occur during the northern hemisphere winter! By making most years 365 days but every fourth year 366 days, the calendar year and the actual year remained more nearly in step. This Julian calender system was used until the year 1582 when Pope Gregory XIII added that leap days should not occur in years ending in 00 except if divisible by 400, providing a further fine tuning. This Gregorian calender system is the one in most common use today.",image,Julius Caesar and Leap Days,https://apod.nasa.gov/apod/image/jcaesar_coin.gif,nan
1996-03-01,"Sometimes the simplest shapes are the hardest to explain. For example, the origin of the mysterious cone-shaped region located just below the center of the above picture remains a mystery. The dark region clearly contains much dust which blocks light from the emission nebula and open cluster NGC 2264 behind it.  One hypothesis holds that the cone is formed by wind particles from an energetic source blowing past the Bok globule at the head of the cone.   Information: The Scale of the Universe Debate in April 1996",image,A Mysterious Cone Nebula,https://apod.nasa.gov/apod/image/cone_aat.gif, Anglo-Australian Telescope Board 
1996-03-02,"Orbiting 1,075 miles above the Earth, a 250 foot wide, inflated, reinforced nylon wheel was conceived in the early 1950s to function as a navigational aid, meteorological station, military platform, and way station for space exploration by rocket pioneer Wernher von Braun. The wheel shaped station could be easily rotated creating artificial gravity so that the astronauts would not suffer the effects of prolonged weightlessness. Von Braun and his team favored building a permanently occupied Earth orbiting space station from which to stage a lunar exploration program. But in the 1960s NASA adopted the Apollo Program, which called for astronauts to transfer to a lunar landing vehicle after achieving lunar orbit, bypassing the construction of von Braun's wheel.   Information: The Scale of the Universe Debate in April 1996",image,Von Braun's Wheel,https://apod.nasa.gov/apod/image/vonb_wheel.gif,nan
1996-03-03,"What formed Ariel's valleys?  This question presented itself when Voyager 2 passed this satellite of Uranus in January 1986.  Speculation includes that heating caused by the ancient tides of Uranus caused moonquakes and massive shifting of the moon's surface. In any event, a huge network of sunken valleys was found to cover this frozen moon, and some unknown material now coats the bottoms of many of these channels. Ariel is the second closest to Uranus outside of Miranda, and is composed of roughly half water ice and half rock. Ariel was discovered by William Lassell in 1851.    Information: The Scale of the Universe Debate in April 1996",image,Uranus' Moon Ariel: Valley World,https://apod.nasa.gov/apod/image/ariel_vg2.gif,nan
1996-03-04,"Titania's tortured terrain is a mix of valleys and craters. NASA's interplanetary robot spacecraft Voyager 2 passed this moon of Uranus in 1986 and took the above photograph. The photograph was then transmitted back to earth by radio. The valleys of Titania resemble those on Ariel indicate that Titania underwent some unknown tumultuous resurfacing event in its distant past. Although Titania is Uranus' largest moon, it is still much smaller than Triton - the largest moon of Uranus' sister planet Neptune. Titania is essentially a large dirty iceball that orbits Uranus - it is composed of about half water-ice and half rock. Titania was discovered by William Hershel in 1787.   Information: The Scale of the Universe Debate in April 1996",image,Uranus' Largest Moon: Titania,https://apod.nasa.gov/apod/image/titania_vg2.gif,nan
1996-03-05,"The center of nearby giant galaxy M87 is a dense and violent place. In this 1994 photograph by the Hubble Space Telescope, a disk of hot gas was found to be orbiting at the center of this massive elliptical galaxy. The disk is evident on the lower left of the above photograph. The rotation speed of gas in this disk indicates the mass of the object the gas is orbiting, while the size of the disk indicates an approximate volume of the central object. These observations yield a central density so high that the only hypothesized object that could live there is a black hole. The picture also shows a highly energetic jet emanating from the central object. The jet is composed of fast moving charged particles and has broken into knots as small as 10 light years across.   Information: The Scale of the Universe Debate in April 1996",image,A Black Hole in M87's Center?,https://apod.nasa.gov/apod/image/m87bh_hst.gif,nan
1996-03-06,"SS433 is one of the most exotic star systems known to astronomers. Its unremarkable name stems from its inclusion in a catalog of stars which emit radiation characteristic of atomic hydrogen. Its very remarkable behavior stems from a compact object, a black hole or neutron star, which has produced an accretion disk with jets. As illustrated in this artist's vision of the SS433 system based on observational data, a massive, hot star (left) is locked in a mutual orbit with a compact object. Material transfers from the massive star into an accretion disk surrounding the compact object blasting out two jets of ionized gas in opposite directions - at about 1/4 the speed of light! Radiation from the jet tilted toward the observer is blueshifted, while radiation from the jet tilted away is redshifted. The binary system itself completes an orbit in about 13 days while the jets precess (wobble like a top) with a period of about 164 days. Are the jets from SS433 related to those from black holes at the centers of galaxies?   Information: The Scale of the Universe Debate in April 1996",image,Jets From SS433,https://apod.nasa.gov/apod/image/ss433_art.gif,nan
1996-03-07,"A supernova explosion of a high-mass star results in fast moving blast waves. At the front of the waves shown above, ionized gas in the Veil Supernova Remnant rushes out from the explosion, sweeps up material, and breaks up many atoms into constituent ions and electrons. Observations with the Hubble Space Telescope in 1993 indicate that the blue shock wave was catapult away from the stellar explosion after the red shock wave and has yet to catch up to it in some regions. The Veil supernova remnant's has a very large angular size - six times the diameter of the full moon - and different parts of it are known as the Cygnus Loop and catalog numbers NGC 6960, NGC 6979, NGC 6992, and NGC 6995.   Information: The Scale of the Universe Debate in April 1996",image,Rampaging Fronts of the Veil Nebula,https://apod.nasa.gov/apod/image/veil_hst.gif,nan
1996-03-08,"Jodrell Bank in England is the home of the Lovell Telescope one of the largest radio telescopes in the world. Completed in 1957 under the direction of Bernard Lovell, the 250 ft. diameter dish was the largest steerable radio telescope. The telescope has been used to monitor extremely faint radio emissions from space, including the transmissions of the Pioneer spacecraft in the distant Solar System. The telescope has been used in many astronomical investigations, including the determination of structure in local interstellar gas, searches for pulsars, determining molecular abundances towards the Galactic center, and mapping hydrogen emission in galaxies. Currently, the telescope is not really for sale.   Information: The Scale of the Universe Debate in April 1996",image,The 76 Meter Lovell Radio Telescope,https://apod.nasa.gov/apod/image/lovell_jod.gif,nan
1996-03-09,"The Arecibo radio telescope is currently the largest single-dish telescope in the world. First opening in 1963, this 305 meter (1000 foot) radio telescope resides in a natural valley of Puerto Rico. The Arecibo telescope has been used for many astronomical research projects, including searches and studies of pulsars, and mapping atomic and molecular gas in the Galaxy and the universe. As the Arecibo dish can also be used to send radio waves, it has bounced and recorded radiation off of planets in our Solar System, and has even broadcast messages to areas of the Galaxy that might contain intelligent extra-terrestrial life. Any person in the world may use the telescope, providing their proposal is selected by a review committee.   Information: The Scale of the Universe Debate in April 1996",image,Arecibo: The Largest Telescope,https://apod.nasa.gov/apod/image/arecibo_naic.gif,nan
1996-03-10,"The first module of the Russian Space Agency's Mir Space Station was launched into orbit 10 years ago (on February 20, 1986). Mir has since been substantially expanded in orbit by adding additional modules including the Kvant Astrophysics Module (1987) and recently a docking module. NASA's Space Shuttle Atlantis was modified to allow it to dock with Mir in 1995 (STS-71,, STS 74) beginning a series of Shuttle-Mir flights scheduled to continue through 1997. In this wide angle view - poised above planet Earth with sunlight glinting from solar panels - Mir and Atlantis are seen connected via the docking module from the perspective of the shuttle payload bay. The image is from an IMAX movie frame taken during the STS 74 mission. In late 1997, building on this jointly developed understanding and experience, the US and Russia will launch the first modules of the International Space Station.   Information: The Scale of the Universe Debate in April 1996",image,Mir is 10,https://apod.nasa.gov/apod/image/mir_sts74.gif,nan
1996-03-11,"No spacecraft from Earth has yet explored Pluto but astronomers have found ways of mapping its surface. A stunning map of this distant, diminutive planet, the first based on direct images, was revealed late last week in a Hubble Space Telescope press release. Above are two opposite hemisphere views of the computer constructed map of Pluto's surface (north is up). The grid pattern is due to the computer technique used where each grid element is over 100 miles across. The map is based on Hubble images made when Pluto was a mere 3 billion miles distant. It shows strong brightness variations - confirming and substantially improving upon ground based observations. While the brightness variations may be due to surface features like craters and basins they are more likely caused by regions of nitrogen and methane frost. The frost regions should show seasonal changes which can be tracked in future Hubble observations. Yes, Pluto is a planet even though it is only 2/3 the size of Earth's Moon!   Information: The Scale of the Universe Debate in April 1996",image,Hubble Telescope Maps Pluto,https://apod.nasa.gov/apod/image/pluto2_hst.gif,nan
1996-03-12,"The many spectacular colors of the Rho Ophiuchi (oh'-fee-yu-kee) clouds highlight the many processes that occur there. The blue regions shine primarily by reflected light. Blue light from the star rho Ophiuchi and nearby stars reflects more efficiently off this portion of the nebula than red light. The Earth's daytime sky appears blue for the same reason. The red and yellow regions shine primarily because of emission of the nebula's atomic and molecular gas.  Light from nearby stars - particularly the bright star Antares in this case - knocks electrons away from the gas, which then shines when the electrons recombine with the gas. The dark regions are caused by dust grains - born in young stellar atmospheres - which effectively block light emitted behind them. The Rho Ophiuchi star clouds, well in front of the globular cluster M4 visible on far lower left, are even more colorful than humans can see - the clouds emits light in every wavelength band from the radio to the gamma-ray.   Information: The Scale of the Universe Debate in April 1996",image,The Colorful Clouds of Rho Ophiuchi,https://apod.nasa.gov/apod/image/rho_uks.gif," Royal Observatory, Edinburgh, Anglo-Australian Observatory "
1996-03-13,"The reaction of ancient peoples to the appearance of bright comets has toppled empires, de-throned kings, and been taken as a sign of great things to come. Probably some of these comets did not get as bright as Comet Hyakutake (hyah-koo-tah-kay) will in the next two weeks. It is likely that every major news organization will soon cover Comet Hyakutake extensively.  Comet Hyakutake is shown above already showing a tail of dust. This image, taken directly from a photographic negative, shows stars as black spots and the bright comet coma and tail as dark clouds against the white background of space. During its closest approach to the Earth on March 25th, Comet Hyakutake will appear in the Northern hemisphere as a diffuse ball of light brighter than most stars. Comet Hyakutake will be visible then most of the night even without binoculars, passing above the stars in the handle of the Big Dipper. Comet Hyakutake will be best seen in dark skies far from city lights, where its tail - possibly extending 20 degrees or more - will be most easily visible. As Comet Hyakutake recedes from the Earth it will fade, but brighten again as it nears the sun later in April. At that time it will be best seen in the southern hemisphere. There is no chance Comet Hyakutake will hit the Earth.   Information: The Scale of the Universe Debate in April 1996",image,Here Comes Comet Hyakutake,https://apod.nasa.gov/apod/image/hyakutake_eso.gif,nan
1996-03-14,"Where did Comet Hyakutake come from? The orbits of the Earth and this brightening comet are shown in the above diagram. The blue disk is bounded by the circular orbit of the Earth about the central Sun. The comet's path outlines the green shape. The shape of the comet's orbit is close to a parabola. The comet has come in from the outer Solar System, will pass near the Earth in late March, and pass near the Sun in late April.  Comet Hyakutake will appear bright in late March because it is so close to the Earth, and will again appear bright in late April because it is so close to the Sun. In late March, the comet will be north of the Earth and so only visible in the Northern hemisphere. Information about how to see Comet Hyakutake is available from many University astronomy departments and planetaria.  Information: The Scale of the Universe Debate in April 1996",image,Comet Hyakutake's Orbit,https://apod.nasa.gov/apod/image/hyakutake_sep.gif,nan
1996-03-15,"This odd-looking structure silhouetted in the foreground houses the three largest solar telescopes in the world. Located in Kitt Peak, Arizona, the largest telescope inside the McMath-Pierce Facility is 1.6-meters in diameter and contains only mirrors. The telescope contains no windows or lenses because focusing bright sunlight would overheat them. Visible in the background of this sunrise photo are the Moon and Venus. The telescopes are used in many research projects including determining the Sun's structure, researching the cause of the solar corona, monitoring Sun-spots and solar flares, and observing bright planets and comets near the Sun. The telescopes even help monitor the Earth's atmospheric content of ozone and CFCs!   Information: The Scale of the Universe Debate in April 1996",image,The McMath-Pierce Solar Observatory,https://apod.nasa.gov/apod/image/mcmath_bk.gif," Bill Keel,  University of Alabama "
1996-03-16,"Spiral galaxy M90 is near the center of the Virgo Cluster of Galaxies - the closest cluster of galaxies to the our own Milky Way Galaxy. Also dubbed NGC 4569, this galaxy has a very compact and bright nucleus. Because of M90's proximity and motion inside the Virgo Cluster, M90 actually shows a blueshift - indicating that it is moving toward us rather than away. Most galaxies show a redshift which indicates that they move away from us. Calibrating exactly how redshift relates to distance would indicate a scale for our universe - a topic of much debate recently.    Information: The Scale of the Universe Debate in April 1996",image,Spiral Galaxy M90,https://apod.nasa.gov/apod/image/m90_keel.gif," Bill Keel  (University of Alabama) 1.1-meter Hall Telescope,  Lowell Observatory "
1996-03-17,"This close-up of the tops of Saturn's clouds was taken by the Voyager 1 robot spacecraft as it passed the giant planet in November 1980.  Saturn's clouds are mostly composed of hydrogen and helium gas, but the small addition of other elements gives the clouds their colors. These colors have been computer enhanced in the above photograph. Usually the clouds are divided into just bands and belt, but the center of this photograph shows the addition of a red oval cloud. The oval's origin remains a mystery, although its color indicates that its composition is slightly different than surrounding clouds. A new spacecraft - Cassini - will visit Saturn and is currently scheduled for launch in 1997.   Information: The Scale of the Universe Debate in April 1996",image,Saturn's Cloud Tops,https://apod.nasa.gov/apod/image/satcloud_vg1.gif,nan
1996-03-18,"Saturn and two of its larger moons - Tethys and Dione - were photographed by the Voyager 1 spacecraft which flew by the planet in November of 1980. This picture gives an indication of Saturn's extensive ring system, which can be seen casting a shadow on the planet, as does Tethys. Saturn's rings are composed of many chunks of ice ranging in size from a pebble to a car. The rings have several large gaps, the largest of which is clearly visible in the picture and is named the Cassini Division, after its discoverer.  Saturn appears brighter than most stars in the sky, and its rings can be discerned with a small telescope. A new spacecraft - Cassini - will visit Saturn and is currently scheduled for launch in 1997.   Information: The Scale of the Universe Debate in April 1996",image,Saturn with Moons Tethys and Dione,https://apod.nasa.gov/apod/image/satmoons_vg1.gif,nan
1996-03-19,"This picture of Comet Hyakutake was taken on March 14, 1996. Structure in the ion tale of Comet Hyakutake is now clearly visible. An ion tale forms as a comet nears the Sun.  Sunlight causes gas and dust to boil off the comet's solid nucleus. Charged gas - called ions - are then accelerated away from the Sun by the solar wind - fast moving particles streaming out from the Sun's corona. The ion tale will appear blue and glows by fluorescence. As Comet Hyakutake gets closer to the Sun during the next month, a dust tail is expected to be visible as well.  Dust tails shine by light reflected from the Sun.  Comet tails point away from the Sun, even as a comet moves away from the Sun. For observers in the Northern Hemisphere, Comet Hyakutake should appear tonight in the eastern part of the constellation of Virgo and should be about magnitude 2.5. The comet will look the most impressive in the darkest skies - in a city you are likely to see only a fuzzy blob!   Information: The Scale of the Universe Debate in April 1996",image,The Ion Tail of Comet Hyakutake,https://apod.nasa.gov/apod/image/hyakutake_14Mar_eso.gif,nan
1996-03-20,The Orion Nebula is visible to the unaided eye as a fuzzy patch near the famous belt of three stars in the constellation Orion. The above picture captures a part of the Orion Nebula that primarily reflects light from bright Orion stars. This reflection nebula appears blue because the blue light from the neighboring stars scatters more efficiently from nebula gas than does red light. The dark lanes are composed of mostly interstellar dust - fine needle-shaped carbon grains.   Information: The Scale of the Universe Debate in April 1996,image,NGC 1977: Blue Reflection Nebula in Orion,https://apod.nasa.gov/apod/image/ngc1977_aat.gif, Anglo-Australian Telescope Board 
1996-03-21,"This March 19th false-color picture of Comet Hyakutake from one of the most sophisticated ground based telescopes captures the area surrounding the comet's nucleus.  A comet's nucleus - not directly visible here - is a solid dirty iceball probably no more than 10 kilometers across. This image shows, for the first time, features of irregular brightness in the coma surrounding the nucleus.  The beginning of the ion tale is visible as the bright feature emanating from the right, approaching about 1000 km from nucleus. At the distance of the comet, the whole field captured here is roughly the size of the Earth. If it's clear, Comet Hyakutake may be easily visible tonight!   Information: The Scale of the Universe Debate in April 1996",image,Near Comet Hyakutake's Nucleus,https://apod.nasa.gov/apod/image/hyakutake_nuc_eso.gif,nan
1996-03-22,"People the world over are preparing to witness the closest approach of the brightest comet of the past twenty years. Comet Hyakutake, discovered just two months ago, will pass nearest the Earth Monday morning. All during the coming week, Comet Hyakutake will be  visible in the northern sky as an unusual extended fuzzy patch. To see the comet is not difficult - just go outside and look up - no telescope is required! The comet's location in the sky during late March is charted above. The horizon is drawn for about 8 pm in your local time. By about 11 pm, Comet Hyakutake will be high in the sky and well placed for viewing. Although Comet Hyakutake is whizzing past the Earth at a blistering speed of almost 100,000 miles per hour, and it is practically streaking across the sky by astronomical standards, it will appear to move only a few degrees on any given night. Each night this weekend and in the coming week, the comet will be visible. Please don't miss this rare and exciting astronomical event!   Latest Comet Hyakutake images: Crni Vrh Observatory, Slovenia, Fayetteville Observer-Times",image,Where to See Comet Hyakutake,https://apod.nasa.gov/apod/image/hyakutake_kw.gif,"Ken White, Izzy's  Skylog "
1996-03-23,"The above false-color picture of Comet Hyakutake taken just two days ago shows its rapidly developing tail. The comet now has a substantial coma with a bright center, lending it a dramatic eye-like appearance. This is not Comet Hyakutake's first visit to the inner Solar System. Recent orbital determinations clearly show Comet Hyakutake's was here before, although the previous approach is estimated to be about 8600 years ago - during the epoch of the first recorded human cities. Were this the comet's first trip to the inner Solar System, it probably would not appear as bright as it does now - first time comets typically do not shed as much luminous gas as veterans. Before making any approach to the inner Solar System, Comet Hyakutake was dormant in the Oort cloud of the outer Solar System for a few billion years, along with hundreds of thousands of similar comets. Comet Hyakutake is predicted to become the brightest comet since Comet West in 1976, which rivaled the brightest stars in the sky. Tonight, Comet Hyakutake can be seen best from about 10 pm near the Big Dipper's handle.  Latest Comet Hyakutake images: Crni Vrh Observatory, Slovenia, Fayetteville Observer-Times",image,Comet Hyakutake's Past and Future,https://apod.nasa.gov/apod/image/hyakutake_20Mar_cvo.gif," Herman Mikuz, Crni Vrh Observatory,  Slovenia "
